{
    "schema_version":  "1.0.0",
    "content_ref":  {
                        "revision":  1,
                        "status":  "approved",
                        "body_sha256":  "ef3ab2cc32b4fc016a1cf929abfd75523a9aeb3703206df7a1568317583a6de6",
                        "writing_id":  "demo-writing-001"
                    },
    "visual_plan":  {
                        "content_type":  "search",
                        "page_count":  1,
                        "canvas":  {
                                       "width":  1080,
                                       "height":  1440,
                                       "format":  "svg"
                                   },
                        "style_preset":  "synthetic-editorial-v1",
                        "user_notes":  "合成演示，不代表正式视觉模板。"
                    },
    "pages":  [
                  {
                      "page_id":  "page-01",
                      "sequence":  1,
                      "purpose":  "Cover and three-step summary",
                      "text":  [
                                   "学习桌面整理",
                                   "先清理暂时不用的物品",
                                   "划分常用区",
                                   "每天两分钟归位"
                               ],
                      "asset_refs":  [
                                         "asset-demo-01"
                                     ]
                  }
              ],
    "image_tasks":  [
                        {
                            "task_id":  "image-task-01",
                            "page_id":  "page-01",
                            "description":  "使用本地合成 SVG 页面资产",
                            "status":  "ready",
                            "provider":  null
                        }
                    ],
    "assets":  [
                   {
                       "asset_id":  "asset-demo-01",
                       "kind":  "synthetic",
                       "uri":  "visual-asset.svg",
                       "synthetic":  true,
                       "license_status":  "not_applicable",
                       "credit":  null
                   }
               ],
    "render_outputs":  [
                           {
                               "page_id":  "page-01",
                               "path":  "visual-asset.svg",
                               "format":  "svg",
                               "width":  1080,
                               "height":  1440,
                               "sha256":  "8bbd75bd0871329ff73ea55dd9921737f87d671d7bdd537bbba242c4e6cb6540",
                               "renderer_version":  "static-synthetic-fixture-1.0"
                           }
                       ],
    "qa_result":  {
                      "status":  "pass",
                      "checks":  [
                                     {
                                         "id":  "approved_body_hash",
                                         "status":  "pass",
                                         "message":  "Synthetic finalization hash matches."
                                     },
                                     {
                                         "id":  "relative_output_path",
                                         "status":  "pass",
                                         "message":  "Relative path only."
                                     },
                                     {
                                         "id":  "synthetic_asset",
                                         "status":  "pass",
                                         "message":  "Asset is synthetic."
                                     }
                                 ],
                      "human_visual_review":  "approved"
                  },
    "production_manifest":  {
                                "manifest_version":  "1.0.0",
                                "created_at":  "2026-09-30T00:00:00Z",
                                "contract_versions":  {
                                                          "task_card":  "1.0.0",
                                                          "keyword_plan":  "1.0.0",
                                                          "finalization":  "1.0.0",
                                                          "visual_output":  "1.0.0"
                                                      },
                                "body_sha256":  "ef3ab2cc32b4fc016a1cf929abfd75523a9aeb3703206df7a1568317583a6de6",
                                "page_outputs":  [
                                                     "visual-asset.svg"
                                                 ],
                                "qa_status":  "pass",
                                "generator_version":  "static-synthetic-fixture-1.0",
                                "writing_id":  "demo-writing-001",
                                "revision":  1
                            }
}